{
  "name": "injection-control",
  "version": "1.0.0",
  "description": "Deterministic CLI warning-channel control.",
  "schema_version": "1.0.0",
  "tags": ["test"],
  "compatibility": {},
  "contributions": {
    "orchestrator": {
      "principles": [
        {
          "id": "injection-control-principle",
          "content_file": "contributions/principle.md",
          "after": null
        }
      ]
    }
  }
}
